data,label
baik kadang bungkus oleh rencana buruk kadang keburu itu lapis dalam baik,0
bang adek kasih nama pande agustio panggil tio keren bang,0
sangat hibur betul dik,0
moga suatu saat bisa main film dengan anya daaannn,0
marinas kan ada fat kalo mau renang saja,0
bohong banget kalo enggak ngewe,1
paling murah indonesia,1
hujan apa yang sarang mbak rara,0
selingkuh itu enggak ada berkah,0
jejak digital kasihan nanti suami dan anak nya kalo tahu orang tua pernah pacar kayak begini,1
nanti saya masak neng makn saja,0
bodoamat syarat mau sama gua enggak kalo mau enggak malem ini gua jemput,0
kok bisa sih badan bagus itu apa nik enggak pernah makan kali pengin tau cara diet bagaimana,0
enak cif sama kamu,1
besar juga buah,1
belum nikah begini gaya pacar astagfirullah,1
allah seremmmmmm naudzibillahi mindzalik,0
iphone,0
cium terus adegan ngentot nya ada kah,1
andai punya pacar binal ini,1
numpang tanya min ini kumpul wibu mana soal pengin kumpul bareng kalian semua,0
kasih sayang ibu untuk anak,0
cantik banget,0
kak luna enggak lah sekali namjoon lagi sana kaaann,0
wajah cantik sedekah tubuh buat cowok,1
gila sih kalau sampai prot prot,1
god ble the family,0
banyak ini konten edukasi kayak begini ded sangat manfaat untuk anak perempuan,0
kumpul ras kuat bumi wkw,0
wanita yang pandai ber shalawat belum tentu dia pandai tahan syahwat,1
kalau baca komentar kok lebih banyak yang omong ica nya ini tentang listy dia yang lagi terombang ambing dan dapat orang yang turut arti langkah nya salah tapi dia begitu sensitif dan peduli susah untuk pribadi kaya listy buat ngungkapin apa yang dia rasai kecuali dia kasih tempat big hug buat listy lama mama kamu masih ada kamu masih bisa buat beliau bahagia kadang kita perlu masalah buat lihat betapa sayang keluarga kita enggak apa deh deh lewat bulan,0
muka bocil badan tante,1
pengin follback idola,0
dasar buaya betina tidak puas dengan satu batang,1
sekali jangan pakai baju,1
ekspresi key cute banget,0
wkwkwk enggak senyum,0
keluarga kecil yang sangat bahagia semangat terus depan nama benzema,0
janji enggak crot crot,1
lanjut tempat sepi bos,1
mungkin ini yang sebut konten edukasi turut perintah,0
ganggu jiwa,0
rencana sih buat history mau pamer tapi bodohh buka aib sendiri,1
omong sendiri jawab sendiri,0
tadi nisa bagai iconing cewek muda dari makeup style dll jadi bangga kalo bilang mirip nisa sabyan lah sekarang bilang mirip nisa sabyan pada muntah,1
wtf konten separuh berdiri,1
gede juga,1
nen nenen tebal,1
kelas cantik semua,0
bodi nya mantap ini cewek muka nya biasa saja sih,1
lagi gatal,0
aku nntonya tak kecilin suara pak,0
sama aku juga rinduh nik balas dong,0
respect sama denny benar asa kaya konsultasi sama psikolog gue tuju sama listy jane enggak bakal bisa maaf aku bukan karena lebih tuhan tetapi karena mental gue ngerasain posisi kaya jane tapi lebih waras dan mental hancur sampai sekarang susah banget percaya sama orang utama wanita jadi ansos panik sendiri jane benar kuat mental kuat,0
moga lancar terus bikin video nya okeyz,0
mengapa ica jane balik lagi sama eriko mending sama jerome saja lah sudah bukti baik amin moga jadi nyata,0
nice sempurna aku akan selalu jadi ratu puja walau hanya angan tak kan paling khayal dengan nyai ratu nikita mirzani,1
jangan pakai merci kadang gue pakai motor saja muntah,0
jadi pengin ajar jujitsu sama anak anak karena mereka cewek semua dan harus bisa lindung diri terimakasih dedy konten sangat manfaat,0
gila kok strong banget,0
halo yang cantik dan tarik moga sukses selalu,0
aku suka banget dulu enggak peduli arti,0
jam berapa,1
nama yang palin bagus adalahharsan arti dari nama ini adalah kebahagian nama ini juga bagusariel arti singa tuhan,0
suatu hubung yang mulai dengan cara yang tidak baik pasti akan akhir dengan tidak baik juga,0
lovee abi senang banget lihat dinarr jadi bikin tambah semangat,0
halo kak kekeyi,0
besar barang botol kecap mah masuk,1
cantik manis enak gurih,1
buset apa itu bor,0
parah murtad,1
wah habis lihat video satu kata sudah tidak perawan lagi,1
wkwk dasar betina,1
gurih deh apem nya mau dong,1
mantap memek,1
video kayak begini saja kecam padahal biasa saja enggak ada yang langgar cuman memang anya nya saja yang body nya memang too hot seksi jujur arti yang ngecam memang pikir jorok,1
mantap kawan,0
mengapa sih perempuan kerja sudah nikah saja,1
selamat malam,0
lepas dari segala macam bentuk sensasi yang dia buat tapi soal skill makeup dia jago banget dan aku hibur sih panjang tonton konten pakai ini semangat kekeyi,0
moga enggak ketemu wanita seperti roh halus,1
tocil mantap,1
gede banget kak,1
kaya ada sesuatu yang lihat deh kak,1
wanita mah mengapa sih kaya laki laki sudah rumah nikah buat anak,1
ada yang tau lokasi foto ini mana,0
selamat kak adek nya gemas,0
enggak akan bisa move,0
salah fokus warna tas nya moon cantik banget,0
belum nih,0
kakak ria nanti buat konten yang lucu lagi dengan kakak angga kakak ria,0
dari awal gue ikut podcast nya bang denny jujur dadi beberapa bntang tamu yang undang buat gue pribadi banyak hal yang positif bisa gue ambil utama buat gue pribadi agar bisa jadi pribadi yang lebih baik lagi moga sukses terus bang denny moga selalu bisa meng inspirasi buat semua orang,0
betah kerja sana,0
barang siapa yang tidak dosa boleh rajam orang itu inti kalimat ini pokok kata yang selalu gue ingat dari kata tuhan,0
jujur saja gue tempat posisi bagai dia lama tonton podcast know how you feeling right now feel sis semangat yuk bangkit life must goes sis everyone makes mistakes when you started tapi cry also cry semangat yuk,0
bisa bikin patah,0
aya siapa pakai dempu smpel begini,0
terlalu paksa gunung dua nya nyai kayak mau letus kulit tipis banget,1
anak nya lucu jadi gemas sama mama,0
hati hati kalian masuk golong orang yang mengfitnah orang logika saja usia beda jauh dan kita lirik masa lampau sih ayus sabyan sudah ada niat buat deketin nih sabyan bukan mau negatif tingking atau bagaimana karena alam lingkung kerja saya sudah pernah jadi orang wanita muda yang sholeha pelet oleh lelaki yang beda umur jauh dari dia sehingga sih wanita tunduk pada lelaki itu tanpa sadar apa yang telah laku mending logika saja netizen kalian lirik masa lampau bukankah ayus sabyan pernah taruh rasa pada nih waktu nih masih sama iya kan nah jangan sembarang cap orang bagai pelakor jika nih kena ilmu mikat dari ayu maka kalian sudah masuk golong penfitnah karena sudah menfitnah nih,0
idihh jadi cewek kasar amat,1
wanita enggak perlu sekolah apalagi kuliah tinggi karena ujung ujung nikah tugas dapur juga,1
dia karya dan dia tidak mendengarkn kata kata negatif dari netizen banyak yang gasuka sama konten nya tapi dia selalu semangat dan sampai bisa cari hasil nya sendiri positive vibes banget,0
allah bisa junjung tinggi jerajatmu setinggi langit allah juga bisa jatuh ketika,0
tinggi banget sama sha allah,0
baik banget kalian sukses terus,0
cewek yang mau lihat kontol panjang gue langsung saja gue kirim,1
absen dulu guys tonton dari daerah mana saja nih moga kalian sehat terus,0
mantap bang sering saja buat vidio begini,0
moga sehet selalu dan tambah lagi rejiki nya amin,0
pada aneh lihat netizen sekarang rasa sok benar kalo enggak suka lihat kak nik enggak usah komen lah owalah cukup jadi tonton saja,0
ampul ampul,0
allah istri cantik banget sumpah ini istri idam semua laki laki,0
gua bikin squirt menang luuu lontequ,1
memang lagu apa itu jadi penisirin,0
opening nya sudah bagus bestie cara sampai nya juga sudah tata pasti circle nya bukan kaleng nih kekeyi jangan lupa bahagia bestie sahabat,0
kadang tambah usia dan alam buat orang ingin ubah tapi jejak digital susah hapus dan bisa lihat oleh calon pasang suami anak dan cucu kelak duh jadi bagaimana begitu pas lihat sok mesra dan romantis tapi endingnya putus sayang dan kurang bagaimana begitu,1
jujur aku yang enggak pernah tau konten kekeyi tapi lihat video ini aku rasa sekarang bawa lebih enak dan cara omong juga lebih sambung lebih tata beda sama dulu moga depan makin lebih baik lagi proud you kekeyi,0
moga sukses not projeck,0
senang banget lihat podcastnya dedy yang ini jujur aku perempuan dan punya anak perempuan yang totally enggak bisa bela diri sama sekali dan pengin banget ikut latih bjj ini karena bagi aku selamat diri itu nomor satu dan bagai motivasi diri juga buat aku dan anak karena kalo kita enggak ajar dari sekarang kapan lagi buat dedy sukses terus untuk podcastnya dan tetap buka wawas kita untuk junjung terus benar,0
sadis,1
seduh susu mau,1
selamat makan kakak cantik dan selamat sore,0
temenin tonton one piece,0
allhamdullilah telah tonton video ini gue jadi lebih rasa bangga jadi anak desa,0
ada coklat tempel gigit mbak,0
spill baju dong,0
bawa asa nih,0
jadi moment yang paling harga haha,0
sange nih,1
ira sambil ngobel atau nyusu begitu sambil nlpn cowonya sekali,1
astagfirullah untung bikin keluarga syasya pun nakal juga tapi enggak lihat kan sosmed,1
korea enggak ada artis yang suka ngumbar begini cuma sini nih,1
cantik wanita itu apabila cantik agama cantik agama maka cantik akhlak akhlak yang cantik ini akan bentuk peribadi yang baik dan didik diri jadi wanita solehah yang sedang taat perintah allah dia pelihara aurat dia lindung maruahnya dia jaga batas dia wanita yang akan bawa tenang dan bahagia akhlak yang baik akan buat kita nang walaupun anda kita tidak pandai atau kenal seperti mana bunga yang cantik akan suka walaupun ianya tidak wangi jangan pernah judge hijab yang pakai jangan pernah jugde baik baik yang telah laku bila kemudian kamu tahu satu daripada salah yang telah saudara laku sebab apa hijab dan akhlak ialah dua hal yang beda hijab adalah perintah dari allah sedang manusia tetap dalam kodrat yang tak pernah luput daripada dosa lagi kita dapat apa jika sibuk koreksi aib sedang dia mungkin tengah sibuk beristighfar dan taubat atas salah,0
anya akting cuman cium doang yang bagus telah itu biasa saja akting,1
padahal itu saklar lampu depan rumah,0
anya jadi candu ganas sekarang,1
bang bikin konten yuri part bangdan moga dapat silver play button bang mahardika silverskin,0
sayang sih cantik cantik hobbynya wot,1
todoroki jual sate minum tanpa modal arang sama,0
masyaaloh ami cantik banget sehat selalu ami moga ami bahagia terus sama anak ami amin,0
tiap manusia perlu air mata supaya mereka bisa cerita dari hati denny sumargo,0
lanjut part,0
kalau perhati yang nyosor anya mulu,1
buset indonesia sudah lupa ramah tamah timur nya putus urat malu,1
kakak moga bayi sehat,0
gilir ukhty saja lucu coba kami kami ini yang laki laki pasti caci,1
cantik banget,0
sudah seperti budaya barat,0
semua pada bilang lebih berat sih jane maaf tapi ada listy saat ini dan depan lah yang paling berat kak jane msi milik nama baik kerja yang baik fan yang banyak fisik yang bagus masalah hati yang kecewa itu bisa hilang oleh waktu senang yang lain karena kasih sayang family friend fan ini sih listy sudah hilang kerja nama baik rusak status enggak jelas cap balmond hujat haters anggap beban keluarga sudah serak kali sumpah deh lagi listy juga manusia lagi dalam ada down ketemu laki yang agak fkboy gmpng ikut arus lah tolong lah jangan ngehujat listy lagi kalian hujat tambah dosa kalian,1
ibu muda kali cantik,0
halah mana yang pakai bikini kontol,1
gemoy banget adek bayi,0
kok buluk sih,1
mau jadi jalang ada hadiah kok neraka dada mana mana pamerin,1
bagaimana asa orang tua nya lihat anak nya,1
mbak nikita mbak itu puja aku mau jadi bagi dari lengkap nikmat yang lembut dan halus agar bisa jadi layan hasrat buat ratu nikita mirzani,1
nge gas tipis tipis,0
salut sama kak kartika putri sekarang dia sudah hijrah dan sangat cantik guna pakai syar nya alhamdulillah,0
euhhhhhh sih lucu,0
pernah ngalamin pas foto bareng tamu tangan tabok karena luk dari belakang,1
iiiiiiihhhhh lucu kali bayi nya sehat selalu dek supaya buat banggga bapak sama ibuk nya,0
kencang dan tantang banget dek,1
wah ini kalau gue foto bintang sana bakal jelas banget sih milky way nya,0
bahagia selalu kalian,0
pispot tempat buang kenang mantan kuning dong,0
lihat nakal nyata mahal lihat mahal nyata jual diri ealah,1
itu yang jerit mau anak,1
wkwk nama juga cewek,1
memek lebar banget sih cantik,1
lihat sudah kendur neng mungkin ada lawar yang sudah hinggap,1
enak nih sekap kost,1
terima thr via ovo dana kak,0
dia pikir ini budaya barat,0
selamat hari raya idul fitri mohon maaf lahir batin,0
gede sih ini mah,1
rumput tetangga memang lihat lebih hijau sampai lupa yang punya dalam pagar banyak yang ingin,0
jaman gue enggak begini otw mau sekolah lagi tapi malu sama umut,0
musik band itu haram apalagi kumpul dengan yang bukan mahrom nya sudah pasti timbul fitnah dan jadi hal yang tidak ingin,1
wokey saya sudah lihat dan video kamu laptop hilang semua dan itu pernah mana mana selalu sendiri,0
mami dan ata tambah sukses selalu sehat lancar rezky nya,0
kok enggak malu manusia kan bukan hewan,1
ada sedikit rasa respect gue sama listy dia enggak sepenuh nya salah tapi gue juga enggak bela dia dia tetap salah dan buat erick juga gue harap bagai laki laki dia bisa tanggung jawab sama apa yang sudah dia lakuin ini ajar banget sih buat para anak muda,0
pantesan beli kondom situ selalu habis nyata pakai sendiri,1
dah enggak perawan,1
kak kekeyi apa kabar,0
semangat konte juta enggak bulan ini buat not projek,0
jangan lupa mampir bos,0
cuma joget doang tiktok bisa jadi artis dada samping jadi cewek bo,1
jane memang paling cantik,0
thank ded konten yang sangat edukasi dan manfaat sering sering bikin konten beladiri dong ukses,0
muka boleh enggak,1
pakai upnya flawle good kob kekeyi,0
moga allah maaf salah kita semua itu sebab dalam syariat islam larang gaul bebas antara laki laki dan perempuan karena sudah dekat zina dan bisik setan sangat kuat ini buat ajar bang kita semua kalau memang sudah siap mending kita meni yang halal insyaallah berkah dunia dan akhirat dan tiap kita manusia akan tanggung jawab buat kita akhirat kelak dari presiden sampai rakyat jelata dari para nabi ustad sampai orang biasa semua akan hisab,0
belum pernah dengar cowok bilang kayak begitu sih tapi kalo cewek banyak,0
apakah ini mythia,0
mantap semangat,0
listy aku cinta erikerik video lain gue cinta jane gue cinta banget sama janejane jerome ketawa bahagia,0
lmaooo enak pegang kontol,1
padahal dulu tepo,1
sorry kak baru buka pas ada notifikasi dari channel ini langsung lihat,0
berapa banyak keluar tahi nya kak,1
jangan saja salah orang kalo salah orang langsung mantap tuh,1
itu yang jual barang nya doang atau sama kasir juga,1
dari ribu subscribe deh juta lagi mantap teteh,0
ukhty naukhty lonte semua orang ini crot sayang,1
moga jadi anak yang cerdas erti dan jadi panutan yang baik buat semua orang,0
sempat enggak datang dua kali bor,0
ica jane bang undang biar adil,0
enggak ada damage anjir wkwkwk,0
masyaaallah moga konten video ini inspirasi banyak kaum hawa untuk ajar bela diri seperti bjj atau jenis agar hindar dari potensi diperk dan jenis aniaya lain barakallah untuk mas deddy dan channelnya serta all the crew,0
mau ngulum burung enggak kak,1
memang agak lain beliau yang satu ini,0
cewek itu bisa enggak usah maki nya,1
ajak atuh jalan nya teteh,0
pink enggak,1
kok gue lihat kayak cabe mangga dua,1
cantik sih tapi,1
senang banget lihat keluarga bahagia ini,0
hapus kasihan buna sudah hijrah,0
love you ria,0
lumayan panas sama mantan,0
dah ledug kali tuh cewek murah banget,1
pakai apa saja kakak mah tetap cantik,0
berisik banget sih ibu tumpang semua deh pada turun,0
romantis banget kak sehat selalu buat keluarga harmonis nya,0
mending jadi kayak miyabi sekali,1
kak boleh jujur enggak nih,0
orang mana kak likeback dan follback dong,0
balik anggunya hijab dapat sisi binal yang buat tegang joni para lelaki keras dan urat,1
dari sini kita bisa ajar enggak ada yang nama pelakor bor whatever like this selingkuh itu ada karena mau sama mau bukan cuma dari belah pihak,0
pasti yang lihat anu kajung,1
kembali lagi sama chanel lonte,1
mantap nih muka,1
ikut kak krisna dari masih pacar sampai sudah punya anakrasanya mantap sehat terus kak krisna kak mila sama adek bayi nya,0
moga sehat selalu,0
cuk gila cuk,0
macam tumor hahaha moga segera kena kanker itu susu yang selalu dipamerin,1
ini sebagain gera olahraga dedy itu edukasi untuk banyak orang bukan adegan yang aneh aneh saya pernah ajar kayak smackdown seperti itu kunci waktu tarung teknik thanks yuk deddy,0
masyaallah gadis cantik dan baik hati natural wajah sabar juga moga selalu kah oleh allah amin,0
kalau boleh tau sini ada yang pernah beli produk langsing badan enggak saya mau beli tapi saya tidak tau produk mana yang bagus,0
akupres artis kurang prestasi,0
gara berita ini paksa saya harus putar balik terbang saya london meski pilot dan tumpang lain geram kepada saya tapi demi abar berita ini kepada karang kepada ombak kepada matahari tetapi semua diam tetapi semua bisu tinggalah aku sendiri terpa tatap langit,0
anjir pengin ketawa tru ampek ngiler wee,0
sudah masuk berapa kontol,1
jago nyepong,1
ayok laporankan video ini biar hapus oleh youtube kasi kak rachel sudah hijrah malah foto dulunya jadi bahan tonton banyak orang,0
pagi alim malam bangsat ekwk,1
habis debat sama cowonya kayak,0
mantap banget bikin ngaceng sumpah btw kirim full,1
enggak usah treak treak cewek enggak bikin kereta nya terbang apa mobil tiba tiba pohon kgakk,0
akting cium bibir anyalah jago,1
ini semua yang kalian ingin kan nitijen wkwk lonte kita sama ini,1
seru lihat ded siksa bjj lebih jarak dekat yang memang sentuh tubuh dan ded pernah bilang bjj untuk duel lantai aku pernah latih sedikit yongudo salah satu bela diri standar tni ada yang bisa buat jarak dekat dan jauh dan bisa lengkap dengan senjata tangan bela diri itu perlu kata kang yayan orang yang punya skill bela diri punya aura yang intimidasi sehingga tidak kalau ada yang papas orang itu bakal mikir mikir kalo mau ajak duel selain itu aku juga suka dengan indah seni bela diri masing masing bela diri ada gera dan seni yang kalo lihat itu manja mata kali semangat fina edukasi bjj nya cuma memang enggak imbang kalo lawan ded yang badan lebih besar dan punya disiplin bela diri yang banyak juga enggak cuma bjj,0
belum nikah sudah obok obok,1
antusias warga demi buah bokep wkwk,1
buset banyak atur jadi bini,1
wanita yang punya harga dari tinggi itu tidk akan rusak rumah tangga orang lain apa alasanya,1
yang kayak begini yang gue tunggu,1
pasti mantap jepit,1
bagai orang yang pernah posisi susah loh lupainnya maaf iya sampai sekarang sudah bas tahun lalu sudah maaf karena dia orang yang enggak bisa gue benci tapi sampai sekarang pun enggak pernah bisa lupa sama sekali rasa bagaimana kalo ada yang bahas tentang affair selalu ingat masalah itu dan masih suka menang sendirinyathat sih why coba jadi orang yang baik sama orang lain jangan coba sekalipun khianatin orang lain mau bagaimana ada kamu karena kdg ada orang yang gampang move dari orang lain yang nyakitin mereka mereka bisa balik lagi nyapa kamu kayak biasa tapi enggak dari rasa sakit itu sendiri,0
setan memang akan terus ajak manusia tempat allah lindung kami dari hal seperti ini moga kami selalu ingat akan larang amin,0
jangan sedih ayang,0
untung dunia artis indonesia masih ada deddy corbuzier yang banyak edukasi masyarakat,0
jilbab nakal,1
semua yang tubuh nya memang lihat indah tapi palsu sama kayak parfum isi ulang wangi sih tapi palsu,1
murah banget foto kayak begini,1
asa melar banget enggak sih,1
sudah nongol lagi bae kagak tau apa hati tepotek potek,0
senang dunia insya allah senang dunia akhirat amin,0
kalo bo kakak via marketplace bisa bayar via indomaret kak,1
enggak nyangka sekarang sudah jadi suami mbak lita,0
bicara keren nih bisa paham sama asa lawan bicara sudah didik paham asa manusia bahkan listy juga bisa enjoy cerita jujur semua walaupun awal tutup telah pancing beberapa kali akhir pecah juga tau enggak sih bang orang yang mental puruk kaya listy itu butuh dengar yang baik kaya abang loh serius sekali lagi terima kasih sudah ngundang dia enggak dia sudah tenang bisa cerita semua orang yang tepat moga semua cepat pulih buat listy please jangan selfharm lagi enggak baik aku kasih tips mending gambar kupu kupu bunga pakai spidol tangan jangan pakai benda tajam lagi love urself,0
siang ucap selamat datang indmrt malam ucap selamat nikmat sayang,0
coba gua bawah dia dia atas,1
kak fath kalau ngonten review kayak cocok colebs sama kak judo,0
ketawa mana padahal tungguin,0
dasar lonte pelakorrrr,1
enggak sesuai judul,0
lihat nenen kamu,1
dedy lalau inspirasi moga sehat selalu dan bisa beri konten yang edukasi dan hibur salam dari salah satu gemar dedi dari bal,0
sehat sehat keluarga kecil bahagia selalu tonton biarpun enggak pertama hehe,0
botol gua berdiri sendiri cok jadi mau tarok susu gede banget puaaas masukin botol masih rapet enggak loer lah masih enak,1
kekeyi itu entertainer benar dia itu komunikatif dan hibur moga jauh dari gimick yang enggak mutu kaya dulu key tetap jalan dengan konten yang seperti ini saja sudah hibur suka sama suara kekey,0
dikentu enak hhha,1
warna baju selalu couple kemarin merah sekarang kuning,0
moga kekey iklasnya benar enggak cuma omong biasa orang kalo dah iklas diam tapi kekey masih perempuan harus banyak sabar nanti kalo ada yang mau deketi ajak nikah saja kalo memang lkiserius pasti mau lain cerita kalo laki cuma numpang,0
pengin banget kenal sama cewek jibab ketat begini sini enggak ada,1
memang ini suara mbak nya,0
sih kuyang,1
ngambil resiko karena malas nunggu menit,0
kalimat yang tepat itu bukan listy orang baik tapi listy sekarang bisa lebih baik karena sungguh orang akan sadar saat sudah buat salah kena tampar dari kata orang baru rasa aku sudah buat salah apa yang buat aku jadi salah aku enggak nge judge listy hanya sja aku juga pernah buat salah dan itu buat aku jadi orang yang lebih baik lagi,0
betina mah begitu enggak pernah jujur,1
tinggal saja cewek kayak begitu asu,1
ski banyak video nih yang paling bagus ulang terus enggak bosenin,0
bagi netizen indonesia tolong jangan saling ngehujat ini enggak ada hubung dengan kalian kan dan tidak ambil makan dari kalian kan,0
selain bisa bahasa inggris video itu lihat attitude jeje baik dan kita ajar bahwa yang ditampilin publik belum tentu dia yang benar,0
moga nih keluarga beri sabar dari segala uji dan lebih dewasa lagi dalam sikap hidup mana yang baik tidak baik,0
pengin banget ajar jiu jitsu ground fight untuk bekal supaya suatu saat ada posisi enggak nyaman bisa ngelock down terima kasih edukasi dedy,0
coba pas lihat video ini kalian jangan pakai asa enggak suka atau benci pasti kalian rasa ada sesuatu yang memang enggak ungkap dan sengaja tutup tutup tapi mau bagaimana lagi yang nama orang lagi benci mau dijelasin benar kaya bagaimana pun juga enggak akan erti coba ego nya rangin sedikit,0
sayang nya sih cowok enggak berani,1
anya lop you,0
nice info ded selalu edukasi dan bangun bangsa ini dengan cara yang cerdas,0
punya kakak pernah hitam,1
miyabinya indonesia,1
ini benar harus banget ajar karena bagai wanita enggak pernah tau apa yang hadap depan dan harus bisa jaga diri sendiri thanks ded,0
kalau kasih asi jangan tutup edukasi buat para mamah muda biar inspirasi,0
salah fokus sama bros nya,0
kira jago ngaji nyata jago ngelonte,1
paling enggak suka kalo lagi ada jadi cewek yang teriak teriak,0
gila keren banget ini edukasi bjj harus makin sama perempuan terima kasih kakak fina keren banget,0
susu kecil kali modal cantik saja,1
nomer,0
kamu sedang bentuk untuk jadi pribadi yang lebih baik dari sekarang percaya kepada tuhan,0
wah wah hari begini ada driver cantik dan seksi kaya kakak cantik deh pasti langka banget tuh tumpang auto banjir nih wkwkwk,1
itu hidup itu dunia tiada yang abadi,0
anjir ada yang cosplay jadi astolfo dong,0
ini yang nama cinta buta kasihan benar sih listy terlalu cinta sama erick makanya begini moga bisa lebih cinta diri sendiri listy,0
konten kali ini sangat manfaat bung deddy buat para cewek bisa ajar beladiri dan ini cewek jago banget salut,0
masih kurang ngerayu nya,0
tikotok belender arti nya montok benar,1
mpok ati versi nakal,1
yang dislike enggak ada akhlak,0
selamattt dapat momonganya kak moga kalian dua bahagia lama dan lancar segala rezeki,0
biar mereka yang tau dan tanggung semua,0
kalah manis ini mah gula aren,0
perempuan bidadari syurga,0
badan banyak tato kayak kulkas gue,1
jadi ingat masa masa dulu tiap malam selalu begadang untuk tani sang buah hati selamat atas lahir baby boy moga jadi keluarga yang bahagia dan harmonis usaha susu tiap jam sekali meski sih kecil sedang tidur supaya gizi dan nutrisi dalam tubuh selalu stabil,0
ampun ini cewek pasti hobi bobok bareng,1
hehhh sini sepongin gue anjing gue mau crotin mulut,1
gila body goals,0
ketika chanel lain undang orang yang prestasi bang denny malah undang orang yang anggap buruk dan itu malah buat gua rasa ini keren ajar kita untuk nilai something dari semua sudutpandang dan yang paling bikin salut kutip ayat alkitab bang denny yang relate sama apa yang hadap biasa tamu bahkan banyak orang luar sana,0
tadi aku sempat bingung buat cari teman curhat buat cari orang yang bisa kasih aku motivasi sampai akhir aku ketemu video ini masalah dalam diri aku nyata hampir sama dengan kak listy chan enggak semua tapi banyak dan kata kata yang mau aku dengar saat ini akhir bisa aku dengar dari bang denny jujur menang tonton ini enggak tau kenapa,0
lah padahal sih fuji dulu juga suka dugem gue pernah lihat video dia hari mati vane tapi sekarang deh hapus,0
lah enggak ketemu kita padahal aku juga tonton kak nik,0
nih mah sih mbak nya juga ganas kayak,1
mau kulike tapi like nya sudah bagus banget pas,0
gue tonton ini menang menang karena gue senang lihat ada jelas detail tentang bjj dan guna khusus untuk cewek anak gue cewek gue akan mati mati suruh anak anak gue ajar bjj,0
darimana duit gebrak meja,0
tiap aku tonton kakak selalu ada yang merinding dan ngilu begitu jadi pengin juga soal masih normal belum pernah begitu,1
