data,label
ankny juga enggak bego amat kali pasti dia lihat atau dengar dari suara angin tetangga tapi itu bagaimnapun orang ibu walaupun bukan dari rahim sendiri pasti akan berat untuk ungkap karena atas dasr rasa tulus nya anak angkatny masha allah,0
gemas babynya,0
jadi diri,0
pengin dinenenin kak nik,1
kok seragam sama kayak instatory barusan,0
artis biasa saja mentingin bodynya seksi seperti lonte saja,1
mau jilmekin sampai becek banget,1
harus bintang warna merah atas harus ada lambang uni soviet,0
buat para haters jangan ngcz seseorg dari masalalu nya karena kalian belum pernh ada posisi nya tetap tahan wlw ada badai mnerjang,0
jujur gua suka podcast bang ngobrol dari hati hati bahasa yang pakai juga bahasa tongkrong santae tapi ngena hati the best lah bang semangat teru,0
pengin sergap dari belakang boleh enggak min,1
keluarga bahagia,0
bawa memang mau nge live,0
tips badan bagus dong kakak sekali rahasia perut rata kakak,0
sudah praktek sama suami kasur ded saya badan kecil cuma berat badan badan suami cuma berat badan dan memang benar saya bisa ngunci badan suami suami saja bilang sakit padahal lama ini saya buka tutup botol saja kadang suka enggak bisa terima kasih sudah bagi ilmu hehe,0
begitu dong kak sekali bar kan mantap wkwkwk,1
heran cowok pada cowok semua dan ganteng ganteng,0
kok banyak banget yang suka sama nih cewek padahal biasa saja jelek enggak ada kuliatas nonjolin dada doang,1
suka sama kalian saling lengkap love guys,0
sungguh indah makhluk cipta tuhan,0
niat sedekah tiap bulan untuk iur bpjs karena iur kita bisa bantu orang lain yang sedang butuh biaya obat insya allah dengan begitu kita dapat pahala dan beri sehat,0
imut parah sih,0
apa coba,0
sering diremes sama cowok gede banget itu neng,1
dari video ini kita semua bisa lihat laku anak jaman sekarang sudah resah kita juga anak kita kita awas dalam guna handphone jangan sampai lihat dan contoh yang tidak layak contoh,0
cantik tapi laku kali malu istighfar,1
pak deddy makin dewasa dan bijaksana sehat selalu pak,0
bagai orang tua ini yang harus jaga kalau punya anak perempuan,0
moga semua perempuan yang sudah ikut peran video nya depan tidak sulit cari damping hidup yang benar serius mulia mereka mjd istri dan ibu dari anak,0
nyala,0
bang denny saran saja baik bang denny minimal kesan canda nya kalo merespon jawab listy karena turut saya sini listy sangat lihat belum benar heal sembuh dari masalah kemarin mental dia masih down dan belum bisa mem canda kan apa yang hubung dengan itu saya yakin bang denny juga bisa lihat karena sudah hadap langsung dengan listy nya mungkin lain kali bang denny bisa lebih hati kalo suatu saat undang narsum yang hubung dengan masalah yang serang mental mereka but other tahan that great man love your channel and love the quotes too semangat terus bang den stay healthy,0
terima kasih terima kasih kalian semua telah kurang dosa dosa nih ateruslah hujat banyak banyak nya nih sangat berteima kasih pada kalian makin banyak hujat dosa dosa nih perlahan akan sedikit kurang dan buat kalian dosa ghibah itu alir dari komen kalian dari ribu orang yang lihat karena dosa ghibah itu lebih besar dari dosa zinah salam mualaikum,0
banyak produk viralnya yang pasti murah dan kini banget,0
love you anya aku mencitaimuuu,0
astaghfirullah manusia ini mengunakan youtube indak sopan dan etika kan tonton anak enggak maka bra lagi janda enggak sopan,1
betina memang doyan rasuk banyak jantan,1
rata banget badan,1
kak fathbayy makin cantik saja nih,0
langgeng terus iya dua,0
allah kasihan sekali anak nya korban dari perempuan enggak punya hati nurani,0
tempat diri bagai tawan telepon tak dering lagi pikir telah biasa rasa sakit hati paham aku sedikit saja aku rela mati demi cinta aku mati dalam hampar ini paham aku sedikit saja peluk aku paham aku sedikit saja,0
ready tapi return tapi become unifier the nation hahaha,0
janda deh,1
menang nya netizen terlalu lebih ini anya padahal ini gadis biasa saja nothing specialnya,1
kagum banget saya pada orang ini kayak gadis abang padahal anak sudah tiga,0
bedak kilo,1
akuuuuu aku kenal kalian dari video ini lho,0
pengin prank dong mau uji nyali,0
dia main pubg waktu mabar dulu pasti dia kenal gue sering dia panggil haha sampai beli akun enggak jadi,0
muka mau crotin enggak,1
pertama nobody perfect karena yang sempurna itu hanya ada lagu andra the backbone dua bahaya puja manusia idola hindar gantung dengan faktor eksternal utama bagai simbol moralitas kalau masih teuteup pengin puja manusia idola balik poin pertama tadi,0
feel sorry for her please love your self moreee you more tahan you know you more tahan you feel everyone makes mistake yang penting tuh you learn from itu hope you recovered soon,0
kasih hati malah pilih jantung,0
btw serius nih ada taxi kayak begini betewehh mangaatt kakak ngontennya,0
bagaimana kabar sekarang,0
yagapapa sih nama kerja kan,0
kok aneh kayak awkward begitu,0
apasih teriak berisik enggak suka banget dengar begitu terus kaum cewek,1
kalo enggak cakep pamer body yang penting fyp,1
kapan kita ketemu ajak makan begitu enggak apa makan padang puluh ribu juga saya mau nyai oooo nyai ajak saya ketemu dooongggggg,0
sedih banget lihat listy jujur dia juga korban sih turut dengan tulus dan sangking tulu nya dia jadi bego dann dirugiin sama sih pihak cowok,0
ini tuh enak digangbang rame,1
saya ucapakan selamat ulang tahu semuga kati dan mudah rezeki,0
memeklu bau,1
janji enggak putus,0
bebas wahai orang kaya selagi kalian dunia,0
kepada kai tolong tiap gang itu beri pintu plang rel nya supaya hal ini tidak jadi orang tua saya juga pernah hampir tabrak,0
kalo lihat gemas kak,0
sholehot garis keras,1
beso beb,0
muka haus kontol,1
gue sih kasihan sama anak okin jejak digital bro,0
masih takut neng nih buka bagaimana mau maju channel nya guys,1
cewek nya tidak bisa mingkem,1
cewek mah enggak usah sekolah tinggi tinggi,1
baru tau ada channel bagus ini bang denny keren banget sih kata nya cara nanggepin cara sampai kata nya enak kali punya teman curhat kayak abangbisa nempatin posisi asa lawan bicara tapi tetap bisa lihat dari kacamata netralkesannya kayak mihak sih lawan bicara padahal niat sindir dan bisa begitu tetap ngritik tapi bahasa enak begitu intelektual banget sih kalimat,0
halu stres nih cewek,1
jangan senyum terus nanti aku melting,1
cowok idam tinggal balik pager biru itu,0
moga hindar dari keluarga kita amin rabal alamin,0
dulu lihat cewek cerdas cantik nyata cuma cewek lugu yang bawa asa sama yang dewasa karena sering temu tumbuh benih cinta larang,1
ajar harga untuk kami semua moga tidak trjdi kepada keluarga kami dan anak cucu kami,0
menang banyak nih aktris sudah berapa aktor yang cium wkwkwk,1
balik netizen yang ngata ini listy selalu dia sebenanrnya orang yang tulus,0
dua tiga mik ngebor itu mek lebar bou kagak sambung haha,1
wkwkw lonte lonte,1
mantap banget ayo ngewe,1
biasa cewek,1
taxi online mana sih pengin coba wkwk,0
memek diobok obok kontol pada mabuk,1
wajah pelakor,1
semua pasti pokus susu nya,1
dulu masih sering main sama franklin sekarang sudah tau cepat celepot saja wkek,1
luar biasa cewek ini moga lancar mbak,0
mantap supir driver nya not project lebih tantang lebih greget sukses truuus nya,0
bukan kerja keras tapi nyarii hawa nafsu dong,1
semua perempuan sama saja,1
bang denny sumargo kalo lagi podcast tanya beda dari yang lain dan yang paling penting bicara pakai hati fellnya ituloh astaga sampai tonton baik,0
tak sabar rasa aku nak jadi macam ini aku pun ada cita cita nak jadi orang ayah juga sekarang ini tapi sayang aku belum ada rezeki lagi huhuhu,0
cantik kali,0
zaman sudah makin hari makin rusak mudah jangan dapat yang seperti ini tuhaan,0
nama juga anya,0
harus negara milik undang aset cantik bagi para satu bangsa agar capai adil seksual bagi seluruh owner lontong gantung bangsa yaitu creampie bukakke dari orang lantar odgj fakir miskin gelandang seluruh pascol indonesia terhadapanya satu bangsa lain merdeka,1
laku kayak begitu cuma buat tonton doang mana ada cowok yang mau jadi suami paling ada cuma pakai doang,1
narsis euy,0
sih kontol bikin saja bagus,1
abang nih jomblo dek bisa kan,1
untung gue miskin jadi sekali bikin dosa juga kecil enggak kaya kaya haha,0
kang den keren kalau lagi konten sante wibawa dapat dan cara tanya nya epic keren keren,0
allah maha kaya bongkar palsu diri nya yang benar,1
sudah pasti longgar cok,1
buset deh napsu amat nih dua joli bentar cium apa lagi dua kamar sedottt dong masa,1
mantap banget bro kalau bisa lebih heboh,0
saya ingin jadi anda damping hidup panjang waktu yang anda ingin sisi anda,0
mantap betul salam urang pandeglang,0
buka baju mbak nikita plii,1
pagi anak yang nyusu malam bapak,1
golong pakai namun seperti telanjang,1
nenen gede,1
doa baik adalah hadiah indah buat anak dari ibu,0
seperti biasa mereka senang senang dengan maksiat nya,1
pakai nya bagus banget key semangat buat terus karya keyy,0
akhir konten begini lagi wkwkw,0
cantik banget sih,0
muka enggak ngejamin yang penting banyak duid,0
berapa tarif malam,1
pintar pakai doa baik untuk kekeyi bahagia selalu,0
ada yang tegak tapi bukan adil wkwkwk,1
cocok nih kalo next vlog review hotel murah riah dengan pandang bagus bal misal,0
nih akhir bingung asu pokok cantik banget tapi sayang kenapa begitu,1
kak nikita cantik nya asli,0
mantap banget gue pengin kalau naik taxi online cewek yang bawa lasung gue kga mau renti deh buat kakak ria sukses terus konten nya mantap,1
memang enak makan tuh kalo jadi lonte,1
allah maha adil dan bijaksana moga mbak riri dapat yang baik dari semua hal baik amin,0
moga aku jadi laki yang jaga hormat istri,0
edukasi benar buat cewek cowok juga buat jaga jaga kita tidak tahu luar sana bakal jadi apa thank ded,0
gue tuju sama bang den listy salah posisi waktu yang enggak tepat luar itu dia baik dan tulus banget,0
mantap nih konten dulu saya pernah ajar judo yang ada kunci seperti ini walau enggak variatif bjj makanya bisa ngerasain apa yang rasa sampai kepala merah begitu dan napas ngos anak perempuan memang harus bekal ilmu seperti ini terus edukasi top banget deh btw vina jago banget,0
cintahh gue,0
laki nya mau tapi malu malu,1
mantab banget senyum bikin gemas,0
anjr kreatip kekeyii bisa ngundang netijen pada tonton mantap keep itu,0
banyak konten begini kak,0
yang penting akhlak,1
untung pakai mask,0
wanita model begini dunia asmara dan rumah tangga bisa tahan berapa lama kok bikin pasang mudah bosan kayak,1
kapan aku ketemu mbak ini biar prank,1
itu coba hidup mari kita kuat kan diri kita dengan iman yang kuat insya allah allah selalu lindung umat yang bertaqwa hindar dari asutan syaitan yang kutuk amin aku robbal alamin,0
wah keren luna main golfny mantap,0
cantik banget kakak nya hehehe,0
andai bisa kenal lebih dekat,0
gila mantap pengin,1
enak nih wot bareng,1
listy pelakor tukang rebut pacar orang cantik kagak tato nih yang sabar kak kan sudah biasa kalau jodoh yang kita pilih cocok maupun tidak,1
nya manya muhammad arfan arty nya puji cerdas,0
atas arab bawah kaya pengin ewe,1
hello moon pakai masker saja tetap lihat wow cantik swing swing swing,0
bagaimana asa orang tua anya kalo lihat ini kasihan jadi bahan gosip lingkung rumah orang tua sih anya,0
waa,0
tiba muncul diberandakeluarga kecil mulai bahagia sudah lahir keturunansemoga anak nya jadi anak soleh bakti kepada orangtua guna buat semua oranganak aku waktu umur segitu kalo pulang kerja cape kalo sudah ketemu anak langsung hilang cape nya,0
emakk mending jadi nyanyi saja maa kalau sudah jago jerit mhh ngentot,1
olahraga berat sudah saran pakai masker sama who malah bahaya olaragawan nya sendiri,0
enak nih untuk nafsu,1
calon terus miyabi ini cewek,1
wkwkwkwkwk ngakak anjir tonton beginiansukses selalu sista,0
gangerti lagi tingkat pada nya gua enggak setinggi dia semangat terus key berkat gua jadi tau cara tahan emosi,1
tiktoknya apa kak,0
luar biasa enggak pcraan artis ingat belum sah itu,0
baru pertama lihat cewek ini podcast dedy cor simak pmbicaraanya seperti enggak cocok banget sama sosok rjky yang polos yang baik dan santun terus rame lagi foto vulgar cewek ini moga rjky cuma kagum saja dan tidak niat untuk pacar apalagi milik,0
sudah enggak sabar nih bang xixixixixi,0
itumah sherry moe deh yang jadi cosplay takt destiny,0
enak diremes itu buah dada,1
rahayu selalu braderku,0
paling auto klik aku tuh kalo konten kayak begini tuh satu bangsa enggak,1
libur dua begitu apa tidak jadi apa,1
tiap manusia perlu air mata supaya mereka bisa cerita dari hati mereka,0
wah cantik buang begitu saja,0
pejuhin muka sama crot dalem,1
lonte indomaret,1
kenapa bang cewenya disabilitas,1
enggak bosan lihat konten mami sama kak dinar,0
wah salut sih ada rekayasa adegan seperti ini buat edukasi para wanita bagai pria saya yakin bahwa banyak laku perkosa luar sana itu anggap wanita lebih lemah dari pria cara fisik sehingga enggak ada awarne hadap serang balik dari korban good job deddy dan fina,0
kekey moga sehat,0
cantik banget pink enggak,1
ada orang yang hidup tanpa urat malu,1
walaupun kekeyi agak kesal tapi dia selalu hibur kita pada saat pandemi covid dengan uni,0
mahhh mau yang kaya begini,0
tiap manusia perlu air mata supaya mereka bisa cerita dari hati denny sumargo,0
