data,label
nikmat selagi masih ada anget dan enak hidup hanya sekali manusia tak akan pernah luput dari yang nama salah tiap orang suci pasti punya masa lalu tiap dosa pasti punya ubah,0
bikin tegak anjir,1
sudah mirip video jepang anjir pasti bentar lagi diunboxing,1
makanya tidak ada teman dengan lawan jenis ujung zina,0
padahal kalau sudah pegang kontol tangan mah sudah enggak enak lagi pegang,1
mau tak belikan teh sayang,0
indah banget sunsetnya jadi pengin nepok,1
enak banget tuh ketiak nya,1
hidup penuh misteri dan tidak jamin orang hanya lihat busana dan alim nya orang,0
alhamdulillah lihat adeknya imut lucu banget moga jadi anak yang soleh solehah dek panjang umur sehat selalu jadi anak yang pintar amin,0
dua tiga mik ngebor itu mek lebar bou kagak sambung haha,1
berisik banget mak,1
cobain prank mas jar dong pasti parah mas jar nya sih,0
bahagia selalu buat kalian,0
key coba makan peluru pelor dong pasti seru yang tuju like,1
dan wanita rasa paling sakit,0
gua tonton bukan pengin malah cengar cengir ketawa ketiwi sendiri,1
dan orang yang nyuruh undang ica jane aku malah enggak tuju dia sini adalah korban dari orang yang punya hidup sakit jadi gaperlu lah biar jane bangkit saja,0
ampun muka enggak cakep amat belagu,1
saya tunggu versi serius mbak,0
cocok nih kalau dengan bang billy gagah tajir soleh,0
dua enggak sungkan dalam pakai seksi setan makin tertawa,1
anjir lihat banget mupengnya enggak rugi itu cowonya mantap,1
nih film buat tahun berapa sih,0
asal jangan konsumsi barang mahal itu,0
selamat blih atas lahir anak nya moga jadi anak yang pintar dll gemar baru dari petang pelaga tapi asli bandung jawa barat salam kenal blih,0
cantik mau dong jepit anu yang baca komentar ini kami doa sehat dan sejahtera senantiasa,1
congratulation brothers his this one your future one more congratulation sama from timor leste,0
bang denny bijak banget sih dari alam orang sekitar bang denny bisa korek begitu tanpa hakim lembut banget nasihatinnya aku rasa seperti dalam diri bang denny itu ada roh kudus yang ngmong hati bang denny untuk listy thumbs uppppp,0
susu idam pacar,1
nyata,0
mau dong jadi tumpang,0
adek bayi nya gnteng banget kayak kak krisna moga sehat selalu,0
itu kalo gua sudah aku tarik itu tangtopnya pas tidur,1
pengin ucapin juga huhuhu buat bulan depan hummmm kayak enggak ada deh,0
bagaimana resep untuk buat kurus,0
montok sekali tetek kamu sayang,1
senang benr lihat kalian anjir,0
full senyum cowok yang sekolah sana,0
kalau sudah wisata begini sudah pasti sering ehem ehem ini para idola jadi ambyar kalau sudah tonton video mungkin para idola masih harap yang idola adalah cewek baik dan masih virgin karena belum ada status nikah kawin,1
nenen nya,1
terimakasih bos anjir keinget miti,0
duh enak kalo diremes,1
malas cuma bisa ronde,1
hapus semua dari publik yang sakit hati perempuan dan yang jadi pelakor biar enggak muncul lagi publik,0
kak aku taksir,0
adegan lidah ketemu lidah,1
enggak bisa kontak saja,0
keren sih nikmir aku apa ada enggak pura bagaimana begitu,0
deh benar petamanya pas nyanyi kawan bengek,0
cantik banget kak,0
pempek terus kakak not,1
bang kalo mao lihat info event cosplay mana,0
sukses selalu kakak dua adeknya lucu,0
ukhty pikir negatif,1
naughtyy wot nih mantap sgnya,1
bilang laki semua sama saja tau betina juga sama,1
pengin raba tan,1
enggak cocok sama ini cari yang lain saja malu sama adik,1
jujur dia cewek bukan murah cuma dia bego saja tapi dia tulus,1
listyyyy semangat hidup ini terlalu indah kalo cuma cicipin yang harus lakuin banyak syukur karena tuhan enggak pernah tidur,0
orang gila semua nih wibu masuk yang punya nih channel juga,1
apa alas tetap selingkuh itu dosa besar,0
gue prnah jadi korban frank kaya begini tapi gue brhenti karena takut dan gelisah moga enggak lagi jadi itu ulang,0
jangan contoh yang kaya begitu kuat lah iman nya,0
ala alaikum salam sejahtera selalupetani yang sukses bisa jadi motivasi kamu jika minat tekun bidang kerja yang satu ini tan rupa satu antara profesi paling mulia panjang masa tani bentuk dasar dari masyarakat dan main peran penting dalam bangun sosial ekonomi negara tanpa hadir tani dunia akan jadi lapar karena produsen makan tidak ada iring dengan tambah populasi manusia beban kerja tani juga makin tambah padahal tak banyak lagi yang pati kerja sektor tani belum lagi dengan risiko gagal panen yang cukup besar karena serang hama atau cuaca tak dukung era modern sistem tani mulai banyak kembang guna tingkat persentasi hasil panen dan buat makan lebih jangkau namun sistem sebut tidak luput dari beberapa lemah dan masih perlu tingkat kembali dukuh channel tani insya allah berkah,0
coli coli,1
dosa nya enggak sedikit bagi usak rumah tabgga orang,1
emoga video ini jadi tunjuk amin teman karya bukan seperti ini cara,0
konten satu bangsa,0
serius itu cowok wkwk,0
bingung mau hujat apa,1
aktu itu waktu aku lihat yutub kak ica yang pertama kali aku kira kak ica itu orang bule beberapa bulan aku kan lihat yutub lagi pas aku lihat bahasa bahasa indonesia,0
bukan manusia kayak,1
mknya jangan mau jadi cewek burik,1
nih cewek nama nya siapa,0
dulu aku respect saja sama nik tapi lama lama bosan juga soal yang dia bahas cuma harta orang hidup orang mending sadar mbak taubat kalau memang enggak ada kerja mending shalat saja taubat sana sudah deh nyinyir orang ada malah nanti malah enggak undang,1
lebar putinng,1
semangat konten makin lagi,0
waduhh adegan yuri nya sangat mantap,1
subhanallah moga allah beri jalan yang baik untuk dua amin,0
asi malah tambah banyak,0
orang normal debat antara tomat sayur atau buah kekey sayur diri dari udang,0
anjir nafsu gua naik gara gara lihat konten begini jadi pengin coba,1
mal aidin wal faidzin kak,0
open bo,1
keluarga bahagia,0
diri bo toh mbak,1
bisa saja nih modus nya ikan pindang kwkwk,0
sama sudah kaya janda anak,1
sangat manfaat agar perempuan bisa bela diri dari tindak jahat,0
insyaallah moga ijabah sama allah kakak,0
jadi ingat waktu kecil,0
kagak gua bolehin keluar rumah punya bini begini,0
pok pok pok keceplek keceplek keceplek,1
itu effect kok pada tipu,1
cantik banget tante,0
akhir lagi dan langsung upload,0
everyone deserve chances tapi better not just the second not just the third banyak sempat semua laku salah semua punya cerita fighting,0
padahal kan bisa begitu pakai camera depan kenapa harus cermin sih,1
lagu lagu nisa sih bagus bagus indah dan merdu terus terang sih saya belum erti arti semua lagu lagu karena bahasa arab belum saya ajar kamus bahasa arab apakah lagu lagu cermin laku nisa atau balik seluruh indonesia bahkan manca negara kagum dengan lagu lagu dulu namun sekarang mbrruukk berita kaget seluruh indonesia bahkan manca negara gadis jilbab tutup aurat lantun lagu lagu religi tapi laku banding balik dengan apa yang harus laku oleh orang gadis sholehah astagfirullahuladzim,1
orang orang kayak begini yang buat orang lain atau sekitar jadi ikut panik teriak teriak enggak jelas,0
selalu cantik kece,0
sarat fyp epon lihat bakat yang tonjol sound yang duk tak duk tak,0
ahahaha anjir kena prank,0
istri orang lebih tantang,1
wow itu gede banget mbak,1
kang cari sensasi wkw,1
contoh seleb sok bijak padahal penuh beban hidup,1
mbak nikita enggak pakai enggak pakai cangcut,1
tag dong,0
denny main psikologi ngeri,0
tayang enggak didik yang banyak sekali mudhorotnya,0
kendur turun itu payudara,1
adek bayi ganteng banget sehat selalu adek,0
new character mama muda wkwkwk,1
cewek tua peot,1
memang cewek kontol berisik banget bantu wkwk,1
allah,0
saya jadi ingat kisah saya dulu ketika naik angkot betul dalam angkot ada ibu muda sedang susu anak yang masih kecil tiba anak mulai menang dan henti nyusu sih ibu langsung ancam anak jangan menang kalau menang entar susu tak kasih itu sambil nunjuk saya anak kembali lagi nyusu saat kemudian anak kembali menang dan ibu muda sebut kembali beri amcaman yang sama dan anak diam dan kembali susu hal sebut terus saja ulang hingga akhir saya kesal dan tanya sama sih ibu muda maaf benar saya bakal kasi nyusu enggak sih masalah rumah saya sudah lewat kilo dari sini,1
mergo aku elek tak melu antri pek subsidi,0
pas bobok bareng apa enggak ingat sama lagu nya yang selalu sebut dengan nama robbi,1
rindu banget sama vlog milkhris,0
semangat susu kak moga sehat debaynya moga sehat susu jaga dengan baik,0
kak kekeyi buat konten tour meja rias kakak dong,0
kalo sama suami boleh lah mbak,0
bahagia terus kalian tiga,0
ngewe lagi dong,1
salut sama istri sabar banget lama itu pendam sendiri dan akhir sudah enggak kuat sabar kak insyaallah balik hancur ada bahagia,0
alhamdullilah cinta larang yang akan jadi halal,0
tatap matanyaaa,0
sayang selamat suang,0
aduh cantik banget istri,0
adem banget sih pir,0
sedikit banget tahu kekey masa udang diblng sayur,1
tante culik aku dong,1
lagu nih kak nidia,0
ini episode berapa kak yang adegan ini,0
makin tua makin enggak moral,1
enggak sangka banget gua ini ajar bahwa jangan pandang orang dari penampilanya,0
hanya teman kerja selesai kerja langsung pulang,0
dan tiap manusia perlu air mata supaya mereka bisa cerita dari hati mereka denny sumargo,0
lagi open bo dia,1
anjir burung gua mau terbang gara gara kakak desah nya mantap,1
bentar lagi nih masuk the spotdengan judul pelakor muda panjang sejarah,1
bang dapat info event event kayak begitu dapat darimana,0
bagus tempat ini kolam renang pun ada,0
rara sibuk dijakarta lagi banyak festival musik outdoor,0
lanjutn terus yang lebih mantap kalau bisa bikin yang enggak sensor twitter lah bayar juga mau saya wkwk,1
nama juga betina,1
ngakak dengar pusar bodong,1
bacot emak emak,1
wkwk bntal guling adek nya sama kayak ponknku haha bahagia selalu kliann,0
lucu adeknya kak sehat selalu,0
gede banget silikon,1
pasti banyak makan craby patty,1
dari semua podcast yang gua tonton cuma channel bang denny yang turut gua keren bagaimana cara dia buat narasumber relax untuk ungkap isi hati terus bawa bang denny yang bisa hipnotis serta tanya yang turut gua bobot,0
woaaaaa ada kak sherry,0
suuppeerrr keerreen banget bangga banget punya latih kaya kak finna terimakasih kak finna karena sudah buat kita semua sadar erti paham guna beladiri jiujitsu terimakasih deddy sudah undang narasumber supperr banget bela para wanitakalo bisa ada beladiri jiujitsu ada tiap kota tiap daerah indonesia agar para wanita anak bisa lindung diri mereka teman mereka dari tindak jahat,0
dunia bisa lihat istri bang terima kasih banget gratis,1
jijik lihat cewek begitu bangsat,1
jelek banget mukaa mbak,1
kembali cerita masa lalu,0
saya saja yang lihat video ini bikin nfsu apa lagi kalau sndainya posisi itu cowok saya dipluk cium tlajng dada pakai bikini siapa yang enggak tahun pasti mlmnya wig wig iya kan ngku saja siapa yang sepemikirn,1
listy aku lebih baik nyakitin diri sendiri daripda orang lainje jane netijen bulshit omong sama laku beda,1
sehat terus kak dinar,0
moga game play top global bisa hibur kalian semua thanks,0
kecantikanya asli wanita indonesia banget,0
gudang dulu yuk,0
bismillah moga ada hikmah balik sen yang salah kirim sen oily kirim dry semog hikmah rezeki bisa dapat sih glopy allahhuma sholi ala sayyidina muhammad cosmetics,0
kpai tolong adegan seperti ini cepat proses jadi contoh buruk bagi anak kita tidak harus juga kalau pacar semua oertonton kan seperti ini,0
mulai dari sini saya percaya bahwa wanita hijab juga sangean,1
buat teman teman itu buat mancing itu umpan buat,0
masalah hati itu susah susah banget erti listy salah banget jadi orang tiga meski alas healing sama sama healing selain nyakitin diri sendiri dia juga nyakitin orang lain oke mungkin orang orang komen pada bilang kasihan listy dia pasti depresi dll coba deh kita juga pikirin bagaimana rasa pihak belah yang punya ambil sama orang yang dia percaya pasti jane nya juga depresi jadi maksud gue tuh kita selalu fokus sama apa yang kita lihat sampai lupa ada hal lain yang kita tuh enggak tau kayak dulu semua hujat listy dan erick gilir ada cerita kayak begini kita mulai dukung listy lagi karena sudah tau cerita balik jadi selingkuh itu mungkin habis ini kita bisa lebih baik dalam komentar kalau ada masalah kita tunggu dua sisi speak biar kita enggak komentar lalu satu sudut pandang saja moga habis ini listy juga temu bahagia sendiri,0
sudah jelas bekas orang hahaha,1
ini cewek mirip,0
sini gue justru mau terima kasih banyak banyak buat listy karena gila parah banget kalo sampai ica jane nikah sama itu orang,0
kok nyosor melulu kayak entokk,1
fix harus undang nih biar kita bisa nilai dari sudut pandang yang beda dan nanti bisa simpul yang baik karena banyak kita dnger rumor rame terus langsung mikir salah benar padahal kita enggak tau sudut pandang rumor biasa bagaimana,0
kakek suka tayang ini jadi ingat masa muda kakek dulu,0
salut sama nisa sabyan lanjut,0
nyepong enak,1
saya pren mbak kota palembang,0
tiga anak kakak nik enggak ada yang mirip babeh nya semua muka kak nik jadi cantik dan ganteng,0
ngumbar tete mulu deh heran,1
jalan hanya buat cium doang,1
sama sama ngehealing dengan cara tidur dengan pacar orang lord inisiatif sekali,1
yang penting akhlak,0
konten bagus adegan asli tidak modus,0
ira salah baca sampai baca ulang kali wkwk,0
bau sih kayak,1
lagu nya rohani hati nya roh halus,1
berat banget dada pengin remas,1
sudah enggak perawan sering,1
manusia tidak luput dari salah dosa,0
alammualaikum terima kasih dedy dan fina atas semua share ilmu betul anak kami perempuan semua mereka harus ajar harus tahu setudaknya harus punya pegang ilmu ini untuk hadap real hidup,0
tau kan apa yang gua pikirin,1
selamat datang indomaret bisa pilih durasi lama atau short,1
kamu cantik persis angelina joley,0
apa cuma gue yang ira mereka lagi rebut tempat duduk yang enggak tanda kali,0
nih yang gede kalau mau,1
tetap cantik manis,0
gigi maju deh kayak mbak,1
salut mbak ririe tahun masih sabar kalo aku mah enggak bakal kuat,0
cowok kayak kang cilok depan komplekkeren,0
live colmek,1
otak romantis terus,0
berat badan kita sama cee,0
kakak moga anak nya sehat selalu dan jadi anak bijak dan rajin yang bisa bahagia orang tua kakak,0
buka dong sayang,1
luar mulia dalam muslihat memang benar bungkus kue kalau lihat luar bikin enak tapi kalau belum rasa pasti belum tentu rasa bagaimana begitu juga dengan yang jadi saat ini dari lagu yang rohani tapi hati yang iblis,1
ini mah malam nya pasti mantab kasurr,1
itu perempuan ikut dajjal yang rusak moral bangsa,1
yaelah masih kalah gok sama anya gwr,1
martabak lempit masih original enggak,1
ampun binal banget deh,1
bau tahi,1
cantik banget kamu,0
karena tangan bisa buat bahagia,0
indah dunia yang sementara ini,0
otw dapat silver play button nih abang,0
asiang bana cewek itu maki model urang lahir anak kembar oto ancua masih bisa bal kalau banyak pitih nyawa hilang kama kadi cari nak min,0
enak bangen disepong,1
nama juga cewek sudah pasti cantik kalo cowok pasti ganteng,0
turut enggak perlu request untuk undang kak jane cara kalo dia suruh klarifikasi sini sama saja dia harus untuk ingat lagi jadi kemarin dan ngebuat dia jadi keinget lagi luka yang mungkin kita bagai orang luar enggak paham betul bagaimana sakit kak jane usaha untuk bangkit telah semua itu,0
gila sih outfit nya cantik banget aaaaaaa mleyot,0
cantik banget kakak,0
astaghfirullah insyaf mbak insyaf aurat jangan umbar,1
alhamdulillah alhamdulillah ikot senang,0
mbak bisa jangan goblok banget bisa enggak sih,1
adek saya biasa kalo lagi telpon sama teman saya gitukan saya jailin manggil sayang,0
luar biasa,0
ini indonesia bung kita punya budaya dan adat istiadat yang beda dari negara lain nya kayak begini umbar medsos,0
iya tuju untuk tes sehat pasang,0
sudah mantap belum,1
eww murah amat,1
salut sama bang denny usaha ngebangun mental baik psikis usaha jadi tempat unek unek yang ingin keluar listy dari segi amat jawab bang denny gue salut banget sih sudah kaya psikolog gue sudah rasa kasihan dari dulu sama listy balik sisi buruk ada sisi baik juga salut sama bang denny,0
susu peot malah pamerin,1
ini konten yang selalu tunggu,0
sehat selalu beli krisna dan mbok mila beby,0
aduh sensor,1
waduh baru serasa ken,1
kekeyi semangat terus kamu inspirasi,0
tali copot muncul susu kadaluarsa atau susu palsu hasil silikon,1
silat lidah anya memang jos,1
bagi pap tetek nya dong kakak,1
sudah cantik baik hati lagi bahagia selalu kak,0
aku kenal kak ibnu sama kak lita dari video ini,0
minta saran untuk nama anak dong guyspande gede isi guys,0
tegang terus gua pusing,1
respect banget sama bang bagaimana dekat cara psikologis bang denny listy dan coba untuk kuat listy karena gua ngersa orang seperti listy lah perlu support gua ngersa banget sendiri nya listy entah npa gua tarik banget sama tato nya listy yang cewek menang dia bilang tato itu seni memang benar bagi gua tato itu seni cara seseorg ekspresi asa mereka baik itu asa suka kagum sedih amarah dll koreksi kalau gua salah dan gua olah ngersa bang denny mungkin juga ngersa hal yang sama kaya gua maybe bahwa gambar diri listy itu sudah rusak gua bukan dukung spa yang dilakuin listy memang salah tapi yang perlu garis bawah tiap orang milik catat hitam masing dalam hidup mereka semua gantung bagaimana dia merespon salah mereka dan bagaimana dia baik catat hitamny kemudian gua juga tuju dengan statementnya bang denny tuhan saja maha kam jika kita tidak dapat ampun orang arti kita derajat lebih tinggi dari tuhan memang enggak mudah untuk maaf orang yang salah sama kita itu semua butuh proses dan waktu lah yang akan meng heal ing sukses terus buat bang denny sumargo,0
cantik,0
ini hati bukan pispot datang pas lagi butuh butuh doang kamu pikir ini pispot,0
dia aku nya masih perawan tapi kok aku enggak yakin,1
pispot tempat buang tinja dan tempat buang manusia hati dajjal tapi kedok bidadari yang sok suci sok ngerti agama tapi akhlak dan lisan rupa dajjal,1
mas nya mirip teman gue woy,0
mantaaaaaap gede banget,1
hadehhhhh kok bisa viral sih cewek enggak jelas kaya begini,1
buat pura pura tidur lagi dong kak saat tumpang nya suruh beli biar tambah seru,0
kasih nama ini saja kak adek bayi nya arti sangat bagus pande arjuna arya basudewa arti arjuna anak yang milik kulit putih dan kesatriaarya terhormatbasudewa kata lain dari khrisnabagu tuh kak,0
gua tarik banget ajar martial arts utama muay thai karena itu penting itu lindung diri anda kita dalam situasi yang harus kita tahan diri kita konten yang sangat manfaat dan bagi kalian yang masih bilang enak jadi sih gne silah coba sendiri datang gym nya kakak fina biar buat pingsan atau patah lengan atau kaki keep the good work kakak edukasi nya,0
lemasin habis bro,1
konten bikin engas,1
konten nya memang bikin iri para jomblo semangat kak,0
nyata ughte juga ada yang jail juga,0
masih ada harap aku dapat yang kaya begitu yang penting kaya,0
podcast episode ini butuh asupan energi yang enggak sedikit totalitas banget ded terima kasih ded edukasi moga tambah sukses tambah berkah amin rabbal alamin,0
seperti nya internet hari ini sudah cukup,0
kapan kita ketemu ajak makan begitu enggak apa makan padang puluh ribu juga saya mau nyai oooo nyai ajak saya ketemu dooongggggg,0
kakak kali ini bedah dari belum lebih cantik dan kawaii,0
siang juga,0
enggak sangka kak nih bisa kayak begini tau aku kak nisa orang yang lembut ramah cantik suara merdu tau kayak begini lak,1
benar itu pacar suami tiung tuing tuing,1
semangat terus kakak bikin vidio nya,0
ngakak njiirrr gila,0
captionnya guna bahasa sastra,0
mau lihat tete gede,1
sering bikin blog sama babynya jadi makin semangat lihat rutinitas kalian pas ada baby bahagia selalu,0
viral chikachandrika dugem club jaga sehat suses selalu,0
jangan terlalu percaya dengan saya saya bisa benci anda dengan wajah senyum,1
heh masih enggak sadar key benerin dulu gigi itu key sudah tua kok makin gilani,1
jelek banget sih,1
muka nya crotin dulu,1
pasti jari mas yang lewat,0
harta tahta wanita uji allah,0
keren bgttttt cantik bgttttt,0
biar enggak post lagi,0
colok enak nih,1
masyaallah kak wirda cantik banget,0
yang begini kok enggak pernah grebek satpol padahal sudah trlnjang ber,1
prgunakanlh waktu sbaik mugkn jangan hanya karena ego hlal kan sgla cara ingat skit senang nya mndptkn semua hrpn kterkenlan itu,0
ajar yang sangat harga bagi para perempuan sangat bantu sekali bagi para perempuan untuk jaga diri dari laki laki yang semena mena hadap wanita sangat manfaat terima kasih ded dan mbak fina,0
dari pada omong harta orang lain mending kamu bahas kritik minyak goreng kan bantu mak indonesia nyai,0
mantap mertua dan orang tua pasti bangga dengan chanel ini palagi pas baca judul auto haru mereka,0
cantik istri nya anjir,1
punya orang tua enggak segani,0
sedih istri rosul lihat ukhti seperti ini,1
semua wanita memang beda sifat nya tapi kalo begitu adalah wanita,1
enak banget suruh cium dah,1
lihat apa wahai anak muda,0
kenyal banget itu aowkwkw,1
sehat selalu buat keluarga pande,0
enggak sangka banget sama nisa yang lihat alim bisa sikap seperti itu,1
enggak bosan lihat muka kak ria cantik gigi bikin gemas gingsul,0
dari awal sampai akhir cium mulu anjir btw tete sih anya belum gede gaban kayak sekarang,1
bukan dia pernah prank kok tumpang nya sama kaya yang dulu,0
iya teman cantik tapi aku tetap pilih kamu,0
cantik moga sukses,0
mau dong crot,1
burung cowok cilik pasti putus,1
pantat bagus banget,1
enggak pakai enggak pakai celana dalam lngsng tancap,1
iniah yang nama cinta tumbuh karena sering ketemu jgnkan ketemu tiap hari chatingan telpon tiap hari walaupaun enggak ketemu saja bisa cintasemoga iman kita kuat dan allah lindung keluarga kita semua amin ajar,0
kak ria memang mamayoo,0
asi memang penting banget begitu juga video ini penting banget untuk edukasi aduh,0
anu dustin sangat tidak tenang,1
cewek naughty tiap malam gandeng cowok baru,1
selamat kakak sehat buat semua,0
bibir ada tahi lalat kamu manis deh,0
seksi nih,1
baru kali ini gue lihat syuting film tabrak kereta,0
bokong kondisi,1
berat rasa nya untuk ungkap makin hari makin gede anak nya deh erti sosmed deh punya banyak tmn kasihan dua,0
bagaimana kalo tantang sejahtera rakyat,0
mau supreme dari kak nikita biar bangga dan percaya diri mungkin orang lihat aku pakai padahal asli,0
aku tetap tonton ulang video ini,0
pikir kita ada yang satu frekuensi,1
sudi kah kamu jadi calon istri,0
renggut perjaka tante,1
silah bisa sekali masukin kak,0
miris kasih anugerah buat lagu rohani laku roh halus ada yang rasa enggak sangka,1
akhir selamat kak krisna dan kak mila moga bayi sehat tonton setia nih bos slebeww,0
makeup nya kak kekey sudah keren skillnya sekarang suka,0
ayang aurat dijagaa,0
pengin crot kacamata ughhh,1
mahardika scarletskin mantab,0
jangan pernah buka hijab,0
alhamdulillah kawan selamat sudah jadi ayah,0
ngakak parah,0
orang yang pikir kotor selalu lihat sisi kotor walaupun konten ini sungguh manfaat bagi kaum hawa allah ded siap hujat demi wanita indonesia,0
ica enggak usah datang enggak usah ngurus hal begini malah ngegali luka lama tau banget rasa diselingkuhin kalau bahas malah bikin sakit lagi mending abai saja,0
gue kiraa ukhty tidak begini sama saja nyata rindu jari tengah,1
nama harus rehan eja kalau rayhan bisa,0
kak angga enggak ngebosenin,0
anjay sih cewee ompong bikin pakai ges,1
ini sudah nikah apa belum sih vulgar banget,1
nisa juga manusia gaes pasti tak luput dari salah karena cinta itu ketetpaksan kita harua bisa tahan dan lanjut selagi itu tidak rugi atau sakit hati orang lain mungkin dia enggak bisa tahan asa cinta apalagi karena sering sama pasti lama nyaman cinta datang karena biasa itu uji bagi mereka dua arti enggak sanggup sama uji nya selamat tahan malu dan hujat nitijen yang utama lahknat allah yang lebih kejam karena telah mendzolimi istri dan anak,0
wah pasti kakak sering langgan kondom,1
sudah bolongin kaya nya tuh lubang,1
hidup wibuuu,0
lucu banget adeknya moga sehat selalu,0
yaudah iya iphone pahamm sudah,0
kalau nikah mahar nya berapa duit yang kaya begini,1
tiga bidadari,0
mbak sadar mbak berisik tau,0
astaga ampun pasti legit banget tuh sumpah anda gue bisa kamu pasti bahagia hidup gue,1
ttny kendur,1
itu enggak balik apa masang lampu nya,0
benar kemarin nyanyi ini,0
terima kasih deddy atas konten karena video ini gue menang karena gue punya adek perempuan dua orang tua gue sudah tinggal gue kerja sendiri pulang malem kadang gue khawatir sama dua adek gue kalau gue enggak ada rumah tapi telah tonton konten ini gue mau ajar hal ini dua adek gue terima kasih deddy,0
cewek kaya begini yang bisa pakai nih jam berapa,1
moga jangan sampai sama,0
tonjol dong,1
mantap tetek nya kalo diisep pasti enak,1
raykeylovers akan selalu hadir sukses terus sehat selalu dan terus karya buat kekeyi raykeylovers bangga pada love you,0
rintis dari bawah telah nama besar boom dadak balik oleh tuhan dalam kejap memang benar musuh orang sukses adalah selingkuh,0
sudah pernah begini sama betina,1
ajar untuk kita semua untuk selalu buat baik,0
kita pun bisa mantab kayak begitu sama anya kalau kita orang kaya whhawhwhwa,1
yang penting yakin enggak ada bimbang dan ragu ehehe,0
body nya ampun,1
cantik sih tapi rela bagi bagi,1
jejak digital tak akan pernah hilang dan ini akan jadi sumber ladang dosa meski saat tua nanti yang sangkut sudah tutup aurat,1
cewek lacur harus kena karma dia habis pakai tinggal saja,1
manusia kalo sudah rasa pintar maka suatu saat dia akan ingkar dan brutal,0
siang ukhty malem slutty,1
suka pokok best buat kakak nikita sehat selallu,0
gigi tolong kondisi key,1
anjayyy moga sehat dan lancar rejeki selalu damping hidup keluarga kalian jangan lupa salam paling anjay,0
hadehhhh sih ini dapat bekas orang,1
kurang gizi kak kurus banget badan payudara tepos,1
beliau ini bukan sembarang beliau,0
laku laku,0
kalian kangen aku enggak,0
pengin main kasar deh,1
yang penting sehat selalu adek bayi nya bun moga jadi anak yang bakti pada orang tua,0
cewek murah,1
bodoh banget jadi cewek,1
